ID,Name,Genre,Description
120, Possum Hunter (2000) , thriller ," Four boys (School Pals) decide to go camping at a hut in the forest before heading off to start college. They tramp into the forest and discover that the hut has been burned down, while looking for something else to sleep in they meet a deranged Possum Hunter in the bush who offers them shelter in his hut. They take up his offer stay in his hut for the night and have a drink with him. Later that night they find a severed hand hidden in a box at the back of the hut and suspect that Hunter might possibly have killed someone and is hiding form the police. The four boys decide to play it cool and raise no alarms but to get out of there in the morning. Morning comes and the boys try to make a hasty retreat but the Hunter gets suspicious of their change of attitude towards him and then discovers that one of them (the boy's) has taken an old bone of his and accuses them of stealing from him, Rob try's to smooth over the situation but gets smacked across the face by the but of his rifle, Hamish rescues Rob from the Hunter but the hunter declares that he is going to give them the length of time of two cigarettes before coming to hunt them down. The boys make a break for it and try and get as far away from the hunter as possible. The hunter finishes his second smoke and the hunt is now on. Now it is a race for the boys to get back to their car with their lives or end up dead in the forest. The boys try and run as fast as they can but one of them trips and sprains his ankle, which leaves the others struggling to keep pace while carrying him. Soon the Hunter catches up to them with his skill and local knowledge of the forest and is trying to shot them down. Despite the boy's jump over step cliff and hide behind a tree truck in the stream below. While seeking cover behind the tree trunk and out of sight of the Hunter, they devise a plan to get back to car. They decide to make a break and run for it. The Hunter can see them from the top of the cliff and takes aim, realizing he is to far up, he jumps down the cliff and try's to chase them. He trips on the way down, dropping his gun and tumbles down to creek. This gives the boys enough time to make a break and get within sight of the car in an empty car park. Hamish decides to brave it walks to the car himself. Once getting to car and thinking the coast is clear, he summons the others to make their break. They do so and then discover once next to the car that the Possum Hunter is hiding behind a tree close by. He points the gun at them and tells them to line up in a single file. The boys do so and as the Hunter prepares to shoot them, the boys make a surprise attack on him and wrestle the hunter to the ground and get his gun from him. Amongst the panic and commotion, and one of the boys shots the Hunter in the chest and then in the heart. The Hunter dies and then there is a new dilemma of deciding what to do with his body- do they bury him in the bush and say nothing or go to the police and risk being tried for murder? After much debate they decide to bury the Hunter the bush. This weighs heavy on the conscious and walk away from the forest scarred forever with a secret they can never tell anybody."
121, The Sandman (????/I) , fantasy ," A wizard attempting to capture Death to bargain for eternal life traps her younger brother Dream instead. Fearful for his safety, the wizard kept him imprisoned in a glass bottle for decades. After his escape, Dream, also known as Morpheus, goes on a quest for his lost objects of power."
122, A Soldier's Christmas (2006) , fantasy ," On Christmas Eve, television news reporter Joe Storm is mysteriously transported from his back yard to a battlefield in Afghanistan. There he discovers first hand the heart and motivation of American soldiers in the field and the importance of their mission."
123, Five Crowns (2015) , fantasy ," ""Five Crowns"" is the culmination of the ""Destroyer Prince"" trilogy started by ""Destroyer Prince"" and followed by ""Conquering Kings"". In this third story, a Storyteller cheats death because Prince Kale takes a liking to him. Escorted by bodyguards Castor and Pollux, the two make their way back to Queen Galla's banquet hall. Peril ensues as Thrasher McCorkindale attempts to snuff out the prince and take the throne."
124, Sorcerer's Dolls (1998) , fantasy ," An enchanted being, Apitok, appears in a boarding school. Although he looks An enchanted being, Apitok, appears in a boarding school. Although he looks like an ordinary boy, long ago he was bewitched by an evil sorcerer for his misbehavior. Apitok brings his magic to the routine of the children's life in the boarding-school."
125, Adech (2014) , fantasy ," Sofia, ""the wisdom"", with a cure is able to heal all diseases. Sofia, the pure, does not want to use his discovery for commercial purposes, for the sake of humanity. Professor John Cardini helped by journalist Sandra Blacks, will investigate this case and discover many fascinating fact about the mystery hidden behind the ""medicine"" of Sofia."
126, To Patch a Broken Star (2018) , fantasy ," What Happens When We Die? - A question that Eshi, a sickly adolescent, gave a lot of thought. Our story follows Eshi in his last moments of life, then his journey through the afterlife that surpasses all he could have imagined. Eshi expects to wake up in some form of Paradise, or maybe feel nothing at all, but instead, is confronted by otherworldly guides that help him on his ""life"" ahead. He discovers that his soul is fractured and must be put back together in the ""Nation of the Gods"" by their Queen, Buluku. The first being he meets is MA TELE, a witch who lives in a cozy cabin in ""space."" After Ma Tele convinces Eshi of his own death and broken soul, she tells him of a nation of gods where Eshi's soul can be repaired and changed; with the help of their Queen. Ma Tele also provides clothing and supplies for him, and points to a red road for Eshi to follow. After this, he encounters seven other guides, including water spirits, fire goddesses, and a Moon goddess. Each has their own lesson to impart as he makes his way towards the city. Unbeknownst to him, every challenge, every new encounter, and every trial unites a the fragments of his soul, preparing him for his next phase of existence and the ultimate decision he has to make."
127, Angelfall (????) , fantasy ," Six weeks after angels of the apocalypse descend to demolish the modern world, street gangs rule the day while fear and superstition rule the night. When warrior angels fly away with a helpless little girl, her seventeen-year-old sister Penryn will do anything to get her back... even if that means making a deal with an enemy angel Raffe, a warrior who has been left bleeding and wingless. Having only each other to rely on for survival, the two journey towards the angel's stronghold where she must risk everything to rescue her sister and he must decide whether to put himself at the mercy of his enemies for the chance to be made whole again."
128, The Guardian (2015) , fantasy ," When Grimley woke up on an isolated beach with no recollection of his mortal past, little did he know that his afterlife was about to start. He suddenly finds himself tasked by the enigmatic Arturo with being the Guardian for the down on his luck Eric. His first day on the job is just like another bad day at the office."
129, Dwellings Close (2012) , fantasy ," Ken an estate agent from London gets mysteriously locked in one of his company's properties at number eight Dwellings Close. Inside he meets Gem, an eccentric young woman who claims to be the property's new tenant, together they will try to find a way out."
130, Hexengeddon (????) , fantasy ," When an act of cruelty against a young witch becomes a social media sensation. The witches of the world declare war on humanity, bringing them into conflict with a loudmouth billionaire American president, a bigoted and sexist minister and the people of an easily swayed media-loving country and the world."
131, Pioneer Marshal (1949) , western ," Santa Dolores is a small western town that is a haven for outlaws and is ruled with an iron hand by Bruce Burnett who extracts large sums for protection from the law. Harvey Masters, a Kansas City policeman disguised as a perfume salesman, comes to town looking for the killer of his brother but is shot down in cold blood by Burnett's henchman Clip Pearson. Ted Post, posing as a cattle broker but really a Dallas Marshal on the trail of an embezzler of cattleman's association funds, gets close scrutiny from the Pearson, but manages to pass himself off as an escaped killer. Ted contacts Huck Homer, a reformed petty-thief who now owns a locksmith shop. Huck is aware of Ted's true identity but can be trusted not to reveal it. Ted finds that the object of his search, Larry Forester, and his sister Susan are in the town, and Susan has been trying to get Larry to return to Dallas and face the charges. Ted finds evidence he needs against Larry and arrests him, but when Larry says that Burnett will force Susan to pay dearly for the loss of the money from his safe, Ted decides to go back and rescue the girl."
132, The Wild Bull's Lair (1925) , western ," Resentful college graduate Eagle Eye, disguises himself as a white man and persuades James Harbison to create a new breed of cattle by crossing cows with bison. The first of the strain, a wild bull called Diablo, escapes from Harbison's ranch and goes to Skull Mountain, headquarters of a band of savage Indians led by Eagle Eye and dedicated to the destruction of the white man. Eagle Eye trains the bull to lead away the rancher's cattle and to gore anyone who attempts to stop him. Dan Allen is sent by the government to investigate and goes to the Harbison ranch, where he falls in love with Eleanor, the rancher's pretty daughter. Eagle Eye lures Harbison and his daughter to Skull Mountain and sets Diablo loose on them; Dan arrives and overcomes the bull. All ends well and Dan marries Eleanor."
133, Marshal Law (2015) , western ," In an alternate history of the United States where the Civil War lasted 10 years, a brilliant scientist is kidnapped by a crazed madman known as John Conway, the United States Marshals are called upon to prevent the impending disaster. To track down Conway, Marshal Colton Barnes enlists the help of Sheriff Royce O'Connell, who has been living in seclusion in an attempt to forget his painful past. Together, they set out with a team of Marshals to hunt down Conway. But nothing can prepare O'Connell or the Marshals for what awaits them."
134, 2 once di piombo (1966) , western ," everyone wants to know who the Mexican is. He always answer slowly, ""my name is Pecos"". Pecos Martinez ( Robert Woods) to be exact, and he's returned to his hometown of Houston to settle up with Clain(Norman Clarke), the leader of a gang of cut-throats. Clain is busy looking for the money from a recent robbery that's been stolen from him. Soon the stolen cash in Pecos' vengeance entwine and all hell breaks loose. Behind the scenes a Bible touting Undertaker (Umberto Raho), a cowardly saloon owner, & a helpful saloon girl (Christina Iosani) become part of the story. This film made Woods as internationally known as Pecos in the third world countries as Franco Nero was known for Django. A Mexican hero against a gang and a town full of gringos- what more could you ask for?"
135," My Pal, the King (1932) ", western ," The King of a small European country, just a boy, takes an interest in Tom Reed's wild west show. Tom puts on a special show just for the King and the two become friends. When the King takes Tom's advise instead of the Count's, the Count has the King kidnaped planning to kill him. When Tom learns of the Kings disappearance he and his troop of men, without any real bullets for their guns, ride off to rescue him."
136, L'ultimo killer (1967) , western ," Ramon's parents are killed by men of landowner John Barrett. While trying to get revenge, Ramon is wounded but has saved the life of Rezza, an old disillusioned killer. While nursing his wounds, the men become reluctanfriends and Rezza teaches Ramon the art of shooting, surviving and the loneliness a killer has to bear. Ramon becomes threat for Barrett, the landowner engages Rezza to kill Ramon."
137, Quantez (1957) , western ," After a bank robbery, Heller and his small gang are on the run from the posse. The gang intends to cross the border into Mexico but their horses are tired. The outlaws decide to make a stopover in the town of Quantez to rest and feed the horses. Heller is a brutal and cynical man who treats his woman, Chaney, with disdain and contempt. Gentry is Heller's second-in-command and he proves to be an experienced and wise gunfighter from the old days. Eastern gunslinger Teach is a newcomer to the West and he's green but eager, with an added touch of gentlemanly chivalry towards women. When Heller treats Chaney bad, Teach defends her, causing violent clashes between himself and Heller. Gentry has to step in and separate the two before they kill each other over Chaney. The last member of the gang, Gato, is a white man who was raised by the Apache and considers himself to be Apache. He is useful to the gang because he knows the region well, he can speak Apache dialects and can use many Apache tricks to throw off the pursuing posse. When the gang reaches the town of Quantez it is shocked to see a deserted ghost town. Nevertheless, they decide to rest there for the night. Gato goes in the night to scout around and he finds an Apache spear with a message that anyone still found in town after sunrise will be killed. Gato realizes there are Apaches around but decides to keep this information to himself. With Apaches lurking around and Heller trying to kill Teach over pretty Chaney it doesn't look like the gang will ever reach Mexico."
138, The Heart of Texas Ryan (1917) , western ," Colonel William Ryan, a ranch owner, in the Lone Star State, has named his only daughter Texas. Jack Parker, a devil-may-care cowpuncher, loves only two things, one is his horse and the other a photograph of Texas Ryan, whom he has never seen. He has named his horse ""Dream Girl"" after the girl of the photograph. After several years in an eastern college, Texas return home. Her father is happy and she is idolized by the cowboys of the ranch. Antonio Moreno is the head of a band of cattle rustlers. His lieutenant, ""Dice"" McAllister, a former road agent, uses his office as marshal as a cloak for unlawful deeds. Moreno and McAllister have long plotted to secure Ryan's wealth, and Moreno resolves to pay court to the girl. In the ""Last Chance"" saloon and dance hall a shooting scrape occurs. Jack Parker, enemy of McAllister, is charged as being an accessory. Harsh words are exchanged and Parker overcomes McAllister in a desperate conflict, and then crosses the border until the disturbance blows over. He returns on the Fourth of July and proceeds to celebrate. Colonel Ryan and Texas meet him and Parker learns she is the girl of the photograph. Moreno and his gang, under pretense of friendship, visit the Ryan ranch during the round-up, and when Texas spurns the Mexican's offer of marriage, he threatens her, and is driven from the ranch. When Texas and her girlfriend, Marion Smith, are riding in the hills, they are seen by Moreno's men. Texas is pursued and made prisoner. Marion brings the news to Colonel Ryan. Jack Parker resolves to free the girl. By an offer of money, he persuades the bandits to free her. Moreno and McAllister rustle the Ryan cattle and are discovered by Parker. During a night of rain and wind he slips into the camp of the outlaws, takes Moreno a prisoner, and leaves a note telling McAllister of what he has done. When McAllister finds the note in the morning, he decides to leave the country. Moreno later makes his escape. Parker decides to go on the trail. He bids Texas farewell, telling her he is not worthy of her. As time passes Texas comes to understand that she loves the cowpuncher. Moreno continues his lawlessness. After a desperate conflict Parker is taken prisoner. Word is brought to Texas Ryan that he is to be shot that evening. The girl tells her father she believes the cattle thieves will spare Jack's life for money and starts in an automobile on her race with death. Moreno gloats over the revenge. The executioner awaits the order to fire. Just as Moreno is about to give the order, Texas arrives. The cupidity of the Mexican bandits is aroused by the gold, and the cowpuncher is freed and takes Texas into his arms."
139, Parade of the West (1930) , western ," Bud Rand, charged with the care of his kid brother Bud, accepts an offer to appear in Copeland's Wild West Show to ride a wild horse called ""Mankiller."" Dude, right-hand man to Copeland, resents Bud's attentions to the show's sharpshooter Mary Owens, and when they fight it out, Bud is the winner. Dude losens the cinch on ""Mankiller"", causing Bud to be trampled and have to stay back when the show moves on. Dude intercepts letters from Bud to Mary and Billy and tells them that Bud is a coward. Billy is taken ill and when Bud goes to see him,he learns the situation of him being called a coward. He returns to ride ""Mankiller"" and breaks him, regaining Billy's confidence and Mary's love, and routs Dude and his henchies. Songs were ""Down in Union County"", ""The Old Chisholm Trail"" and ""Sal's Got a Wooden Leg."""
140, Frisco Tornado (1950) , western ," Outlaws have been capturing Nugget's stagecoaches and killing the driver and guard. He has sent for Marshal Rocky Lane who survives an ambush arriving but loses his identification papers. Nugget suspects Jim Crail is behind all of his troubles and he is right. His men having failed to get Rocky earlier, Crail now uses the man Rocky killed and Rocky's identification papers to claim he is the outlaw they are after."
141, Mughal Road (2018) , history ," The movie is tale of a historical event of the battle that took place as Pakistani tribesmen, known as Kabailies, guided by Pakistani armed forces, crossed over to Baramula. Claiming they needed to suppress a rebellion in the Princely state of Jammu and Kashmir, they swiftly moved to take Baramula instead. They reached the outskirts of Shrinagar as they attempted to enter the summer capital with the intention of gaining control of Maharaja's Palace and the Shrinagar Airport. Maharaja Hari Singh made a plea to India for military intervention. Signing instruments of accession, allowing the Government of India legitimate control over Jammu and Kashmir. The war was initially fought between the 1st Sikh Regiment consisting of only 17 soldiers of the Indian armed forces. The Pakistani and tribesmen forces were about ten thousand strong with militia men disguised with Pakistani military officers for tactile and communications support. Baramula, the second largest town, was under siege by Pakistani Kabailies and the Pakistani Army. A major part of the tale describes how a young local boy named Meer Maqbool Sherwani, turns the tide of the battle in favor of the Indian army by bluffing the Pakistani Kabailies concerning the presence of the Indian armies at the Shrinagar Airport."
142, Agenda Illuminati: Supremacy of the New World Order (2016) , history ," There is a sinister and secretive group of people that run the globe by controlling everything from the banks to the media. They achieve this by owning 99% of the world's wealth, despite the fact that they make up less than 1% of the population. They come from ancient family bloodlines and pass down their power from generation to generation. They have sacred rites and secret rituals, as well as a belief system that stretches back for thousands of years to their very origin. They spawned the religions, the royal families, global business and financial systems. They also benefit monetarily from the revolutions and wars they strategically create on an epic scale. They monitor everything we do and have devised methods to manipulate our thoughts and actions. We are all in their service without even realizing it. For thousands of years they have been doing this with one goal in sight - complete and total supremacy on Earth. This is the darkest, untold tale of the war to control the masses. This is the story of what they believe, what they do, how they do it and why. While they have many names, they have but one origin and purpose. However by using previously unknown and secret sources we will reveal them. This is the Illuminati."
143, Will of the Warrior (2013) , history ," This behind-the-scenes documentary focuses on Marcus Luttrell, the lone survivor of a four-man Navy Seal team ambushed by the Taliban in 2005, and a consultant on the upcoming major motion picture 'Lone Survivor,' directed by Peter Berg and starring Mark Wahlberg. This documentary serves as a companion to Peter Berg's film Lone Survivor, based on former SEAL Marcus Luttrell's book of the same title. Will of the Warrior takes a deeper dive into the lives of the SEALs, examines their WILL to survive, and emphasizes the need to keep their story alive."
144, The Michigan Experience: The American Civil War Years (2011) , history ," In an unprecedented gesture of community spirit, seven leading news anchors from commercial stations around the state have joined us in the telling of Michigan's involvement in one of the most important events in American History. While every eighth grader in Michigan is taught the civil war, Michigan's tremendous contribution has become a part of lost history. We contributed over 90,000 men and one woman Sarah Emma Edmonds from Flint Michigan. There was General George Armstrong Custer who was from Monroe, Michigan. It was Michigan senator Jacob Howard who had a large hand in penning the 13th, 14th and 15th amendments to the Constitution. Nearly 15,000 brave and patriotic men gave their lives to preserve the Union. The Michigan Experience: The American Civil War Years offers viewers an unprecedented look at the hidden and forgotten stories of the lives of men and women and how they made sense of their role in the Civil War by telling stories using the narrative mode of living historians."
145, Why Anzac with Sam Neill (2015) , history ," Sam Neill confronts the Anzac Century through the lens of his family's military tradition. He uncovers forgotten truths that reveal the power of the enduring myth of Anzac that still haunts Australia and New Zealand's histories. Filmed in a score of international locations and against a background of continuing turmoil, Sam's sharing of poignant, intimate stories suggests the universality of our need to remember in ways that may offer redemption."
146, Anna (1996) , history ," The film tells of faithful devotion to spiritual ideals. It is based on Riga St. Anna Stocken's Life Story of the Cistercian Monastery of Mary Magdalene. She lived in the 16th century when the wave of reformation was cold before Riga, and questions about true values and conformism were just as actual as it may be today."
147, The Pioneer (2011) , history ," The film tells the tragic story of the Chinese workers of the Shanghai Yarn Mill in 1925, after being subjected to Japanese non-human treatment, they start the fight under the leadership of the Chinese Communists represented by Tao Liu and Zhenghong Gu."
148, Honfoglal√°s (1996) , history ," Filmed in commemoration of Hungary's 1100th anniversary and on the sites of the actual events, a cast of thousands authentically recreates the 896 AD arrival of the Magyar chief Arpad (Nero) and his seven tribes into the Carpathian basin from the steppes."
149, Nostos: Il ritorno (1989) , history ," At the end of the war, Odysseus, the wandering hero, with his companions begins his sail back home to the Mediterranean. The conclusion of his adventure is delayed by many natural obstacles and he takes an internal journey of fleeting memories of his childhood, his parents, love for a beautiful girl, nostalgia for the past, regret for what he did, and the deep silence that envelops everything. He confronts the most terrible loneliness following a shipwreck in which all the comrades perish."
150, Hitler's Canadians (2007) , history ," Many Canadians don't realize that Canada was home to 40,000 German prisoners of war during the Second World War. Hitler's Canadians chronicles the experience of these POW's; the transition from warrior to captive, and their obsessive, often comical attempts to get back to Germany. Canada's effect on the POWs did not stop with their return home. After the war, several hundred former prisoners returned to Canada to build new lives and raise families in the country that once was their prison."
151, Universo di notte (1962) , music ," Beginning in Las Vegas with a dance of the Bluebells, we are shown a variety, with jugglers, singers, Thai boxing, cock fighting and so on. A Variety taking place in Hong Kong, Manila, New York, Paris, Cremona. The break between an act and the next being a striptease."
152, What Do You Think of the Programme So Far? (1992) , music ," Jim Bob and Fruitbat reminisce about the early years at the 1992 Glastonbury Festival. Featured are music videos for the songs ""Rubbish"", ""Bloodsport For All"", ""Sheriff Fatman"", ""Say It With Flowers"", ""The Only Living Boy In New Cross"", ""Do Re Me So Far So Good"" and ""While You Were Out""."
