ID,Name,Genre,Description
84, Naturally Intense (2008) , sport ," Champion Natural Bodybuilder, Kevin Richardson's video, Naturally Intense, shows the high intensity workouts and principles that enabled him to transform himself from a 125lb teen into a 225lb ripped to shreds natural bodybuilding champion- without the use of steroids or drugs of any kind! Training only 20 minutes three times a week Kevin has been able to forge a world-class physique while still maintaining a balance in life. You don't need to spend countless hours in the gym, to achieve your goals, and Kevin's Naturally Intense approach allows for bodybuilding to truly be a healthy and wholesome pursuit. Having successfully trained hundreds over the past 16 years, he is truly the modern guru of natural bodybuilding. Along with his workout partner, future fitness sensation and drummer extraordinaire, LaFrae Sci, you will see exactly how Kevin trains. No camera tricks, no out takes, just pure hardcore training that show some pretty fantastic examples of pushing it to the limit and beyond. The incredible weights lifted and the phenomenal physiques prove without a doubt that you do not need drugs or special supplements to realize the upper levels of human physical development."
85, The Spiral Bike Project (2005) , sport , This is a movie that tells the story of how a first time custom motorcycle builder (Jeff Bach) built his first bike. This is a family friendly instructional DVD intended for someone who is interested in learning and researching the process of building their own custom motorcycle. The bike was built over the winter of 2005 using common tools available to the average homeowner.
86, Envy (2007) , sport ," Are you ready for the beach? Or just want to fit into that new dress? The Envy Girls are the World's first super team of fitness. Lead by Playmate of the Year, Kara Monaco, all the girls are professional bathing suit models, who, with the help of celebrity fitness expert Michael Carson present a revolutionary new DVD series that focuses on key trouble areas abs, buns, legs and arms that will give you a body that will be the envy of others."
87, 2010 Golden Gloves National Tournament of Champions (2010) , sport ," Complete coverage of the 2010 Golden Gloves National Tournament of Champions. Golden Gloves has been the premier brand for amateur boxing in the United States since their first tournament in 1923. Since then, the Golden Gloves program has led the way in providing opportunities for young boxers to develop personal and athletic skills in and out of the ring. Former Golden Gloves Champions include Joe Louis, Sonny Liston, Muhammad Ali, Joe Frazier, George Foreman, Sugar Ray Leonard, Mike Tyson, Evander Holyfield, Floyd Mayweather Jr, and Oscar De La Hoya."
88," ""Fighters Nation"" (2010) ", sport ," There's no denying the impact that Mixed Martial Arts is having on the world of sports and sports entertainment. What was once an obscure and esoteric fighting style with a small fan base has gone on to become a major multimillion dollar industry, filling basements, pubs and barrooms with devoted followers. Detractors call it brutal, governments treat it with hostility, but there is no denying the draw of Mixed Martial Arts; it is a fight that is pure, a fight that is completely unhinged, a perfect display of two athletes willing to push the limits of the body; shedding blood, sweat and tears in order to carve out one more victory... or fall at the feet of the others shadow."
89, The SixPackNow Abs Workout (2007) , sport ," The SixPackNow Program Abs Workout DVD is the complete Training & Nutrition System to get those all important six pack abs. And it's for both men and women. Hosted by International Fitness Expert Peter Carvell, the DVD combines all the key principles for getting that elusive six pack stomach, from proper training techniques to diet and nutrition, ab workouts to suit all levels of ability (beginner, intermediate and advanced) and an additional 50 exercises to custom build your own workouts! This DVD leaves no stone unturned, it is without doubt the most comprehensive ABS DVD to date"
90, BalanceBall Fitness: Beginner's Workout (2002) , sport ," BalanceBall Fitness is an exciting new way to get into shape using the fun and versatile BalanceBall. Based on the principles of yoga and Pilates, this unique Beginner's Workout introduces you to basic stretching and resistance movements that can help you improve strength, coordination, balance and flexibility. With an added emphasis on breathing and concentration, you'll learn the fundamentals of mind-body awareness and be ready to take yourself to the next level of fitness!"
91, Bird Idol (2010) , animation , The story revolves around a bird called 'Hummi' who is not happy with the bird music and is greatly impressed by human music and how he introduces human music to the bird music by entering into a competition called Bird Idol and with his genuine effort he puts himself and his parents into trouble.
92, Engel mit nur einem Fl√ºgel (2012) , animation ," Six members of the Gothic-Scene and the ghost of a pink bathrobe try to manage everyday life. They are confronted with problems, everybody knows (making the dishes, non-smoking areas, shopping and the own death). The movie is a persiflage to the prejudice about members of the Gothic-Scene. The characters make the stereotypes come true and because of that, everything they try to do, becomes a disaster."
93, Till Eulenspiegel (2012) , animation , Do you already know the story of Till Eulenspiegel? No? Then comes with us and experience his merry adventures.
94, Monster High: Escape from Skull Shores (2012) , animation ," It's officially Spring Break at Monster High, and Lagoona takes her gilfriends across the sea to the Great Barrier Reef, but they are ship wrecked and end up on a mysterious skull shaped island. Here they enjoy the local hospitality until they realize that they are being used by a slippery showman named Farnum to lure the rarest, most mysterious monster of them all, ""the Beast"" into a trap. Frankie is taken by the Beast but tables turn and she ends up rescuing him and returning with him to Monster High. The story goes to high voltage when they realize that Frankie has inadvertently led Farnum to the location of the greatest gathering of monsters anywhere...Monster High."
95," ""Fun Farm"" (2014) ", animation ," 52x7' Fun Farm is a very unique place. A farm operated by funny and weird animals. The most simple thing can turn a regular day at the farm into an exciting day of discovery and adventure. With their diverse personalities they react in completely different (and sometimes crazy) ways to the exact same event. This of course, creates conflict and tension between the characters. Hmmm, I think a recipe for hilarious situations - and with no dialogues! Well, if you loved Looney Tunes you will definitely enjoy Fun Farm."
96, Return of the Commander (2008) , animation ," If Charlie Brown had grown up, he'd probably be a lot like Brandon. He's a thirty-year-old man-child whose dreams of becoming an artistic success have been thwarted in the biggest way possible- he's the lowest of the low in the creative industry... a wedding videographer! Haunted by visions of his 5-year-old self crying at what he's become, Brandon is ready to give up all hope, until one day he gets a mysterious phone call from his childhood mentor, ""Commander"" Mark Kistler. Brandon's world rapidly unravels, and a wacky plot involving killer mechazoid robots and time travel ensues."
97, Alamaya (2013) , animation ," The tale of a 9-year-old boy named Jian - a shy, unassuming child living in the quaint and bustling small town neighbourhood of SS2, Malaysia. Growing up in his mother's flower shop, nosy neighbours, rusty grills and quirky signboards were about all that made up Jian's world."
98," ""Return to Mysterious Island"" (2017) ", animation ," The story combines one survivor of the original cast from the Jules Verne book with memorable new characters drawn not only from Mysterious Island, but also from Verne's Master of the World. These adventures seek the lost island that holds the advanced scientific secrets of the legendary Captain Nemo."
99, Cyber Optics (2012) , animation ," Cyber, the Ruler of Information in the Digital World, is stressed because he can't be everywhere at once to solve Cyber Crime. The Divine Artificial Intelligence searches for a team to assist him and finds three teenage girls, Zip Java and Maya at a Magnet School for Technology. Cyber transfers their Genetic Code to Digital Code so they can traverse Cyber Space, rooting out Criminal Hackers and showing them the error of their evil ways. While almost as harrowing as navigating the halls of a High Tech High School, with classmates Crash Worm and Harumi, fighting cyber crime proves to be a lot more fun."
100, Princess of Rome (2015) , animation ," It is 842. The years seem to be alike, as well people were accustomed to their living in Byzantium. Markets were crowded by sellers and buyers. Guard were bent at the city wall, and its notables have been delivering news of the parish for Tsar. Whereas his messengers were delivering the urgent news about Muslims movements, which was a bugbear for him, since the peace and calm that Byzantium have been blessed with centuries ago was being threatened and able to be vanished. Nevertheless, in Byzantium, children were working, and priest was desperate of the city and people way of living, so he had preached them and promised them with salvation after restating the verses of Gospel. And by the scenery, an old lady waiting the promised day. Inside the castle, the servants were preparing food and cleaning the rooms, halls and corridors. Tsar was at his daily morning walk accompanied by his guards who wait for any new order. But.. A single room in Tsar castle was different, his granddaughter ""Mallika"", who had been always worried. She was not sad for the earthquake that ruined her wedding ceremony, because her grandfather promised to reside a better and special one that Rome have not seen before. In spite of this, she was thinking about injustice and turmoil that people had been suffering from, and how she can help in achieving justice. Nothing can calm her down except prayer and crying, in addition to some dreams that take her to another world. But all the castle dwellers thought that her new wedding ceremony will make her feel better, the wedding that she had never liked and every time she thought about she felt worse. One day, Lady Mallika waked up happily, she had dreamed of a promising future. What was that dream? And how princess of Rome moved to slave market in Baghdad, and then to the house of Imam Ali Al-Hadi (peace be upon him) ? What are the events that lead to achieving the promised annunciation? And why the butterfly and the bat were following ""Mallika""? It will be the events that the interesting movie ""Princess of Rome"" will reveal."
101, Love Bites (2018) , horror ," Hollywood has long since been a haven for vampires and other underworld creatures. They have used the industry to fashion their own lore while protecting them from a human society. Detective Peter King becomes involved personally and professionally with Osvanna Moore, once scream queen, now horror studio mogul and a 400 year old vampire. Together they try to outpace a serial killer who has targeted Osvanna and much of her vampire clan...The Vampires of Hollywood."
102, Dark Remains (2005) , horror ," When the daughter Emma of the technical writer Allen Pyke and the photographer Julie is found slashed in the throat and wrists in their locked apartment, the couple decides to move to an isolated cabin in the mountains in Kingspike. Julie is very depressed and blames Allen for the death of Emma. Once in the new home, Julie sees the spirit of Emma in a photo she took in a nearby abandoned prison and she becomes obsessed shooting pictures of poltergeists. Allen is advised to move from the place by the local Jim Payne, and on May 21st, Allen finds that the former dwellers of the cabin have committed suicide, and he investigates the death in the spot and finds that many people died around May 22nd. He decides to move with Julie to a hotel, but she does not want to give up on Emma."
103, Murderer (2006) , horror ," Set in a dark prison cell on death row, a serial killer ponders the meaning of his life, and decides to kill himself just to experience the rush of dying. He notices that every time he tries to kill himself, some other 'bad' person dies instead. He assumes he is dreaming, as he is also haunted by a strange creature like prison guard who appears every time he attempts suicide. The murderer tries to come up with bizarre ways to finally kill himself once and for all. Ultimately, there is a chilling confrontation between the murderer and the creature haunting him."
104, Matakot ka sa karma (2006) , horror ," This is a horror trilogy ""about an antique shop where the pieces of the furniture each have their own stories from the past. The new owners get their little piece of horror,"" says Joey Reyes. In ""Kama,"" Aleli purchases an antique bed, not realizing that its previous owner of the bed is out to claim her son. ""Aparador"" is about a couple who purchased an antique cabinet where a young man died inside before. In ""Tokador"", an independent woman gets a possessed dresser out to take her soul."
105, Savage Lagoon (2007) , horror ," Beautiful countess of Rudlov disappears in late 1940s. The legend blames the monster, the people blame the lagoon. Nearly 50 years later, the spirited Illona Rudlov, is a struggling ballerina living in New York. When the Velvet Revolution occurs, she decides to go to Czechoslovakia to reclaim her ancestors castle. She falls for a handsome hunter, (Jan) Paul Hawkins and is haunted by a mysterious creature there."
106, SED: Thirst (2017) , horror ," Dominic and Maria were once a happy and social married couple, but an encounter with an ex turns Dominic's world upside down. Now reclusive and living in a desolate wooded area, the strained relationship is marred by Dominic's dark secret - one that has him thirsting for his wife's blood. ""SED"" is a modern take on the vampire genre, replacing an often glamorized look with a gritty view of the monster's struggles."
107, Lust in Hell: Edge of the World (2009) , horror ," (Japanese with English subtitles) After losing her parent in a tragic traffic accident, Koto develops the ability to communicate with the dead. Hospitalized for extreme trauma, Koto escapes to return to the place where her parents died. There she meets Shinji, whose lover also died in a car accident. He and Koto then embark on an illicit and terrifying journey heightened by lust and death."
108, Scars (2016/II) , horror ," SCARS is a psychological thriller, written and directed by Canadian filmmaker Sean K. Robb. In this stark and disturbing story, Scar - a raven-haired punk with blood under her fingernails - and Scarlett - a blond beauty with a penchant for extortion - discover that they enjoy killing men together. 'Killing dudes is easy,' says Scar, as the two women embark on a violent and ruthless killing spree, pursued by the mysterious Det. Mike. A story about what happens to human beings who allow themselves to be consumed by nihilism and misanthropy, SCARS is an exploration of morality and ethics in a post 9/11 world - a tense and terrifying film that's part character study, part slasher flick."
109, The House of Screaming Death (2017) , horror ," Echoing the distinctive and much celebrated great British Gothic Horror films of the 1960-70s, The House of Screaming Death will uphold their successful traditions with the telling of four macabre tales of terror all told by the mysterious Architect. Each horrific segment delves into explicit corners of the supernatural, summoning such damned creations as the ghostly Lady in Grey, stories of Witchcraft most foul, Vampirism and the Occult. But as these horrifying tales unfold with nightmarish conclusions, the Architect also has one last shocking secret of his own to tell. A dark and stormy night... A collector of the macabre weaves four tales of terror for a group of very special guests. ""The Lady in Grey"" - 1943; as the flames of war spread, a veteran of the Great War looks back on the history of Bray Manor and the ghosts that haunt him and the hallways of the ancient house. ""The Witch in the Mirror"" - 1970; Lily Proctor inherits the old house and as the spirit of a witch trapped in the Netherworld by the spectral Necromancers tries desperately to escape back into our realm a dark secret from Lily's past is revealed. ""The Vampyre"" - 1888; following a string of killings a young gentleman comes to Bray Manor. Painted as an outcast by the villagers he befriends a helpless stranger, but his kind heart may be his own undoing. ""The Diabolique"" - Sam Campbell finds himself at the center of strange happenings as an ancient, demonic spirit strives to break into our world. Each of these stories has a sting in its tail, but the final revelations of who the Architect is may just be the biggest shock of all."
110, 12 Nights with the Grulems (2017) , horror ," A Gritty paranormal horror about a team of 6 specially talented investigators looking in to 1 of history's strangest and darkest family's known as THE GRULEMS . A family of 12 who lived in the year 1818 and were said to have practiced dark black magic .Now as legend would have it the GRULEMS worshiped an evil dark entity known only as GLOR. And the GRULEMS had learnt that by each offering an innocent soul up to this dark spirit that they would each obtain the ability to return to our plain of existence for 1 night once every 100 years to act out there Gruesome fantasy's of murder and mayhem. Now 100 years later in the year 1918 there was reports in the area where THE GRULEMS used to live and 144 people were strangely killed in there sleep over the 12 nights that THE GRULEMS are said to be able to return to gather more souls. Now in modern day a group of paranormal investigators have found out about the legend and decide that there next project should be to investigate this legendary family ,they seek out the place THE GRULEMS used to live all them years ago and begin an investigation over the 12 nights legend says the family can return.. The 6 highly trained paranormal investigators and psychic's and a powerful Priest must now do battle with 1 of history's most violent and unpredictable family's known as THE GRULEMS"
111, The Blue Boy (1994) , thriller ," Marie is an insecure housewife whose husband, Joe, is having an affair. The two of them take a holiday to rural Scotland, but by sheer bad luck, end up at the hotel Joe uses for his ""getaways."" There, Marie is told the story of a young boy who drowned in a nearby lake long ago, and finds herself becoming more and more obsessed with his ghost."
112, Killing Grace (????) , thriller ," A prominent couple are returning home when their vehicle unexpectedly crashes into a ditch on a dark desolate road. The husband is injured badly. the wife flags down another car to take her for help. On their way back to save her husband, the wife finds herself on a sudden life threatening detour."
113, Crooked Tree (????) , thriller ," The customarily docile bears in the north woods inexplicably turn aggressive because of the bearwalk, an ancient practice of transmigration of souls of people into animals by those who inhabited the Great Lakes region before the coming of the Europeans. Small town attorney Axel Michelson comes to realize his Native American wife Janis, a descendant of Ottawa chiefs, is possessed by the same evil that possesses the bears, and to stop the rampage, to save his wife, Axel must learn the old ways and defeat the ancient evil on its own terms"
114, Rare Blood (2017) , thriller ," This fast paced, dramatic thriller is set on a remote farm in the KZN Midlands. A family that once dreamed of an idyllic country existence find themselves submerged in a dystopian nightmare. KEIRA (Annie Robinson) and EMMA (Ella Grealy) return from a trip abroad to their home in the Midlands to a world turned upside down by her husband PANOS (Brendan Grealy), and Emma's father. GUNTHER (Mark Mulder) is a friend of Panos and Keira and is helping set up a business deal while staying rent-free in a cottage on the farm. OLGA (Fiona Ramsay) is Panos's sister and together the two hatch a plan to drive Keira from the farm. The film portrays that struggle, an urgent, heart wrenching one night of hell where they have to act and think fast to survive. Keira is surrounded by a slow rot of hidden agendas and it seems that there is no where to turn."
115, The Cellar Door 2: Preymates (????) , thriller ," The nightmare continues for Rudy even though Herman has been locked away in an institution for the criminally insane. A mysterious copycat killer is stalking her, taunting her with the last words on earth she wants to hear; ""Herman wants to play""."
116, Sebunzu feisu (2000) , thriller ," A horrifying crime has been committed in Tokyo: a girl's body was found frozen in a block of ice inside a steel drum. The only lead the police are able to find is a web site calling itself ""Seven's Face"" that seems to know a lot about the case. Soon the information on the page changes, and a new murder victim is found matching the new details. Police detective Uchiyama finds several people who seem very suspicious, but none of them can be conclusively linked to the crimes. Who is committing these murders, and where will the next victim be found?"
117, A Stale Yellow (2009) , thriller ," Rookie Private Investigator Kurt Galloway is fresh out of school and looking for work. To his surprise, when he arrives home an old neighbor, Mr. Mackenzie, is already interested in his services. Mackenzie hires Kurt to find his wife, who has been missing for three weeks in the sordid Chalice City. Positive that his first case is an affair, Kurt rushes off to Chalice City to solve it. But once in town, Kurt soon finds his case taking a much darker and deadlier turn. When brutal criminal murders start taking place all around Kurt, and the people he's been questioning are dying off, Kurt's supposed affair rapidly turns into a supernatural nightmare that is way out of his league.."
118, Dark Mansions (1986) , thriller ," A woman hired to write the history of a wealthy family stays at the family's estate in Oregon. She discovers that she strongly resembles a long-dead ancestor in the family, and finds things happening to her that happened to--and led to the death of--that woman."
119, Separated at Birth (2017) , thriller ," Lucy Pierce grew up believing she had a normal childhood with a loving and supportive mother, until she discovers old articles about the ""Baby Victoria"" disappearance - a high-profile abduction case that occurred when she was born. She is shocked to see that her baby picture is front and center. Determined to find answers, Lucy tracks down her biological mother, Elizabeth Marshall, a criminal prosecutor running for Governor of Pennsylvania. Overnight Lucy goes from an anonymous 20- something to a media sensation. While Lucy's reunion with Elizabeth is heartfelt, the same can't be said for her relationship with her newfound sister, Terri. Spoiled, rudderless and used to being an only child, Terri resents Lucy. Jealousy morphs into sabotage, as Terri realizes that if she can't bring herself up to Lucy's level, she must bring Lucy down to hers. The family reunion spirals out of control as Lucy finds herself in the middle of a police investigation which forces Elizabeth to distance herself to protect her campaign. As Lucy questions who is really trying to defame her, is something more sinister happening to tear this family apart, yet again?"
