ID,Name,Genre,Description
153, Untitled Grunge/Seattle Rock Documentary (????) , music ," The Seattle Grunge music scene changed everything as we knew it when one fateful day Sub -Pop Records decided to begin releasing a new type of music on it's independent label. Slowly from 1989 to 1994 the entire world was changed. Politics began to get more attention, Rock The Vote came into Genx's life and influenced an entire government, socio-economical and even department store clothing lines reflected the nations need for Grunge and the Seattle Scene. But who were the people behind the bands, behind that music and the Grunge scene that took the entire world and upended it's presidents, politics, economy, attitude toward authority and disaffected youth rising up against war and bad choices made for them by their country. This is the story of how Seattle Music changed the world, and who the real influential people behind the Seattle scene are."
154, Live in Lyon (2013) , music ," From his earliest recordings with Roxy Music at the beginning of the 1970s, Bryan Ferry has taken his place as one of the most iconic and innovative musicians and songwriters to emerge in popular music. Ferry's ""Olympia"" tour travelled the world in 2011, including this spectacular performance filmed on July 25 at the ancient Roman amphitheatre in Lyon, France as part of the Nuits de Fourviere Festival. The show features tracks from across Ferry's 40 year career including classic Roxy Music songs, solo hits and his renowned interpretations of other writer's material all delivered with the style and panache that is uniquely Bryan Ferry."
155, Opera Omnibus (1987) , music ," Eight segments of opera films: Sheng Xinma performs a monologue from _A King's Revenge (1955), followed by an excerpt of _The Patriot's Sword_ (1958). Cibo Liang is featured in _An Immortal Refuses Love_ (1958), and Yutang Bai appears in _The Wonder Boy_ (1961). Segment five shows Xingbo Liang, Jiasheng Lin, and Cibo Liang in _The Impartial Bao Gong_ (1967), while segment six is a performance by Northern opera actress Suqiu Yu. The last two are versions of _Red Maid, The Matchmaker_, first a 1958 film with Yanfen Fang and An Banri, followed by one titled _The Little Go-Between_, featuring Baobao Feng and Cibo Liang. It was originally double billed with _South China Stars Special_."
156," ""Villa-Lobos and the String Quartet"" (2012) ", music ," Villa-Lobos is Brazil's most important and well-known Classical Music composer. He is also the most prolific String Quartet composer of the 20th century with 17 full works portrayed in this Complete Works series, where Luminaires like Turibio Santos, president of the Brazilian Academy of Music and the 4 musicians of the Radam√©s Gnattali String Quartet, performers of the series, take their time to analyze his approach to composition, his influences and definitive passion for the country of Brazil. Villa-Lobos and The String Quartets is a musical documentary that portrays the composer and the city that inspired him. Rio De Janeiro, Brazil. The seventeen compositions recorded by the Quartet Radames Gnatalli in these albums form a synthesis of musical production of Heitor Villa-Lobos. Its breeding period extending between the years 1915 and 1957. Opening a window to the most significant phases of the composer and giving options to see technical and aesthetic ambitions of different moments of his career. Recorded between June 2010 and September 2011 in the Presidential Palace, and Palace of the Laranjeiras and Municipal Theater of Rio de Janeiro, Brazil."
157, The Downtown Show (1957) , music ," Music based format with top recording stars in the ""Downtowners"" band. The program was designed as a syndicated program in association with local chambers of commerce to help bring back customers to the downtown areas of cities around the country. The show was one of the first integrated television shows featuring popular radio and television star Jimmie Jackson who hosted the show as well as played the guitar and sang. The show also featured Capitol Records top recording artist Jimmy Bryant. Black Jazz violinist and recording star, ""Stuffy"" Smith along with Black jazz percussionist and recording star, George Jenkins rounded out the ""Downtowners"" sound. A highlight of the show was television's Hollywood Hostess, Anita Coleman who offered the latest Hollywood gossip and guest stars. ""The Downtown show"" featured custom commercial loops that incorporated each local downtown spot so that the viewer had the feeling that these top artist were broadcasting right from their very own local Downtown."
158, My Morning Jacket: Okonokos (2006) , music ," My Morning Jacket: Okonokos is a live concert film by My Morning Jacket released on October 31, 2006. The film was recorded during the band's fall 2005 Z Tour, over two nights at The Fillmore in San Francisco, California. My Morning Jacket: Okonokos is as much a question as it is an answer. It is an enigma wrapped around a riddle. My Morning Jacket: Okonokos is whatever you want it to be. Filmed by Sam Erickson, mixed by Michael Brauer, and mastered by Bob Ludwig."
159, Children in Need Rocks the 80s (2017) , music ," A star-studded line-up celebrates the decade which saw BBC Children in Need's first major appeal. Hosted by Fearne Cotton and Sara Cox, with Roman Kemp capturing all the excitement backstage, this spectacular fundraiser includes performances from a-ha, Bananarama, Boy George, Erasure, Europe, Imagination, Jason Donovan, Katrina, Louisa Johnson, Mica Paris, Nick Heyward, OMD and UB40 featuring Ali, Astro and Mickey. So dust off your shoulder pads, pull on your legwarmers and join in with the audience, who will be dancing the night away to a whole host of 80s classics."
160," ""Beyond the Groove"" (1990) ", music ," A businessman is sent on a journey of musical discovery, through the U.S.A, meeting a variety of musical characters, including, David Stewart, Annie Lennox, Bob Geldorf, Harry Dean Stanton?, and others. A thoroughly enjoyable film to watch - if you appreciate musical talent."
161," ""Million Dollar Traders"" (2009) ", reality-tv ," Million Dollar Traders follows a group of twelve wannabe traders dealing in shares during the events of the financial crisis of 2007-2009 which was then whittled down to the final eight. The contestants came from various backgrounds, including a fight promoter, a day trader, an IT/banking recruitment consultant, a working mother, a retired IT engineer and a student, among others. During the series hedge fund manager Lex van Dam gave the contestants $1 million of his own money to trade for 2 months. Professional trader Anton Kreil, was appointed as the manager of the group. The three-part BBC series, narrated by Andrew Lincoln, was a part of the ""City Season"" programming on the BBC. It aired on BBC 2 in the UK at 9pm on Monday evenings between 12 and 27 January 2009."
162," ""Kirstie Alley's Big Life"" (2010) ", reality-tv ," Kirstie Alley leads a pretty interesting life. She was a Romulan-Vulcan officer in ""Star Trek II,"" a sexy Emmy-winner as Rebecca Howe in ""Cheers,"" the star of blockbuster films ""Look Who's Talking"" and ""Drop Dead Gorgeous"" and of course, her star turns in ""Veronica's Closet"" and ""Fat Actress."" For three decades Kirstie has been making headlines and staying in the forefront of the American conscience. Now, she's granting her fans unprecedented access inside her life...and what a life it is."
163," ""World's Worst Tenants"" (2012) ", reality-tv , This reality was about tenants that were either being evicted for non payment and or violating their lease. Now there were some episodes were people had been living on properties that they probably shouldn't have per legal provisions. Also there was a run of episodes were folk had pets of all kinds and either they complied with the pet policy of their lease or they were given a notice to vacate.
164," ""Apocalyptic Survival"" (????) ", reality-tv ," Introduces our cast to a radically changed world, one in which it will take all they have to survive. In the Pilot's last act, Dow is blasted by a drone and our survivors are running for their lives from Federation soldiers who have just killed James, Jeff and kidnapped Jazzmine..."
165," ""Health Inspectors"" (2012) ", reality-tv ," Health Inspectors features restaurants facing do-or-die stakes. Having failed their most recent health inspection, these restaurants have a second inspection right around the corner, which could literally make or break the business. With 15 years in the food service industry, our expert consultant Ben Vaughn will be called upon to re-vamp the way these restaurants function. Whether it's Marinara sauce that the kitchen staff leaves out uncovered for days and still serves, or a fridge that has rotting foods spreading disease, Ben will do more than just help the restaurant make the grade. He'll make sure the staff is 100% retrained on the safest and healthiest practices and procedures to use moving forward."
166," ""Out Here"" (2012) ", reality-tv ," DJ Williford, a freelance videographer in New York City, goes from street to street to capture the cutting-edge skateboard scene. He follows skateboarder Leo Heinert who shreds throughout the many skate spots of New York. Get an inside look on a typical day in the streets in the first episode of OUT HERE."
167, State Fair Foods (2012) , reality-tv ," Every year State Fair vendors try to top each other to create the most crazy, most delicious, most carb-loaded, over-the-top concoction ever, and fair-goers eat it up. From fried bubble gum, to casserole on a stick, to chocolate covered scorpions, State Fair foods are an adventure all their own and we'll take you along for the ride."
168," ""Disaster Date"" (2009) ", reality-tv ," An MTV reality series where people set up their friends on ""disaster"" blind dates. The victim shows up to their date with an undercover actor/actress who will do their best to turn off/offend/alienate the victim using inside info given by the instigators. If the victim stays for a whole hour, the gag is revealed and they are awarded with $60."
169, Miss Universe 2014 (2015) , reality-tv ," A bunch of rich good looking women compete for who is the most shallow and who can most misrepresent the women of the world. With drama, heartbreak, spray tan and more, this worldwide celebration of the advances in plastic surgery should have you hanging on the edge of your seat."
170," ""Kick Up Your Heels"" (2013) ", reality-tv ," ""Kick up your Heels"" is a sexy, fun new series that brings the high-heeled workout trend right into your own living room. Now you'll have the chance to secretly indulge yourself in the latest trend of working out in high heels without leaving your home. Fashion One is bringing you a six-episode series that includes kickboxing, street-dance and a zumba-esque workout which are all done in high heels. With our experienced instructors, you can kick, twist and twirl your way to better calf muscles, balance and the increased confidence that comes with this high-heeled workout. Each episode will contain a choreographed routine and will give step-by-step instructions on how to do these heart-pumping, stylized workouts. While you can always follow the routines sans heels, we do hope you'll join us in this trend, which is taking the world by storm. Fulfill your inner diva and get ready to ""Kick up your Heels""."
171," ""Associated Press: YouTube Channel"" (2006) ", news ," The Associated Press is the essential global news network, delivering fast, unbiased news from every corner of the world to all media platforms and formats. AP's commitment to independent, comprehensive journalism has deep roots. Founded in 1846, AP has covered all the major news events of the past 165 years, providing high-quality, informed reporting of everything from wars and elections to championship games and royal weddings. AP is the largest and most trusted source of independent news and information. Today, AP employs the latest technology to collect and distribute content - we have daily uploads covering the latest and breaking news in the world of politics, sport and entertainment."
172," ""Hometown Health TV"" (2009) ", news ," Hometown Health TV, LLC has offered various levels of support to; the Lake Sumter Medical Society, March of Dimes of Lake & Sumter, American Cancer Society of Lake/Sumter and Marion units, Florida Hospital Waterman Foundation, Lifestream Behavioral Center, Childrens' Advocacy Center of Lake Sumter, the Education Foundation of Lake and Sumter Counties and many more. Hometown Health TV, LLC and it's sister marketing company, Red Apples Media, have been honored with more than a dozen awards including: 2012 National Business Incubator Association (NBIA) Business of the Year 2012 Community Service Entrepreneur Award by the Lake County League of Cities 2012 Hidden Hero of Health award from the Lake County Health Department As well as numerous AVA, Telly and MarComm awards and a 2011 Communitas Award for Community Service."
173," ""Consider This"" (2013) ", news ," Consider This is a current affairs program dedicated to challenging the status quo. Hosted by Emmy Award-winning journalist Antonio Mora, the show features hard-hitting interviews with newsmakers and nightly panel discussions on issues important to American viewers. We aim to cultivate a dynamic conversation about the issues that matter to you, and your voice is critical to that dialogue."
174," ""Bigfoot TV"" (2008) ", news ," The latest fashion, entertainment, and nightlife events that happen at or around Bigfoot Studios in Cebu, Philippines. Hosted by two young American actors, watch first hand as they explore Cebu and find out what the island has to offer - from launch parties to feature films. The latest fashion, entertainment, and nightlife events that happen at or around Bigfoot Studios in Cebu, Philippines. Hosted by two young American actors, Jude Moore and Emily Trempe, you will be able to watch first hand as they explore Cebu and find out what the island has to offer. Bigfoot TV is where you will see the latest fashion, entertainment, and nightlife events that happen at or around Bigfoot Studios in Cebu, Philippines. Hosted by two young American actors, Jude Moore and Emily Trempe, you will be able to watch first hand as they explore Cebu and find out what the island has to offer! From launch parties to feature films, Bigfoot TV will have the coverage that will keep you coming back for more. It's our goal to provide interesting and up to date news for everyone to see!"
175," ""Story"" (2015) ", news ," Just when you thought it was safe to go back in the water, alarming reports are emerging from the Stewart Island shark tourism industry; And it has been one year since Australia began deporting Kiwi ex-pat criminals back to New Zealand. Almost 370 Kiwis have been forcibly returned to New Zealand and for quite a few, the transition has not been easy."
176," ""Church with Ishah Wright"" (2012) ", news , Movie Actress MP Ishah Wright aka Laurah Guillen and her husband US President Abraham Lincoln Relative Sgt. Nathan Shelby agree on more reasons to be a Christian today.
177," ""AIR: America's Investigative Reports"" (2006) ", news ," In the fall of 2004, a spill of hundreds of gallons of thick crude oil in Seattle's Puget Sound, which no company owned up to, led an intrepid Pulitzer Prize-winning reporter from the SEATTLE POST-INTELLIGENCER to embark on an investigation into the actual state of the Pacific Northwest's oil transport industry."
178," ""KWHY-TV 22 Business News: Executive Summary"" (1964) ", news ," KWHY-TV 22 Business News: ""Executive Summary"" is a live business and financial news program providing up to the minute fundamental technical and economic analysis to assess the current outlook for a wide variety of investment markets, from the traditional stocks and bonds to currencies, commodities, real estate, and foreign markets. Top market experts and analysts are interviewed for their insights into the market movements and their opinions for the future in this 15 minute live news program."
179," ""Years of Crisis"" (1950) ", news ," This tenth annual roundup of the year's news events (the series started on CBS network radio) also included a discussion of the biggest stories of the past decade. The broadcast was nominated for an Emmy Award as ""Best Special News Program."""
180," ""Newsarama"" (2008) ", news ," Newsarama loves comics, action movies, sci-fi and TV shows no one watches. No, really. This makes us cooler than everyone. Newsarama has news, interviews, and exclusives. If it's too fantastic for words, were likely arguing about the finer points of it's coolness. Newsarama serves up a hearty helping of stories, blogs, video interviews, previews and trailers."
181, X Rebirth (2013) , sci-fi ," In the distant future, the X universe faces a period of profound and irrevocable change. While the universe stumbles towards an uncertain future, countless adventures await as new enemies rise in search of power. Enter a young adventurer and his unlikely female ally traveling in an old, battered ship with a glorious past - two people alone against the galaxy, playing a key part in the events to come. The fate of the universe rests in the hands of the player... X Rebirth represents a spectacular new beginning for the X series, offering loyal fans and newcomers alike a vast, vivid and extremely detailed universe to explore throughout the game. Varied gameplay elements such as action-packed space combat, detailed trading mechanics and high-speed space exploration with fast travel allow players to experience a truly unique space saga that will keep them hooked for dozens of hours. X Rebirth features a whole new user experience - it is easier than ever to start with, and remains as deep as fans expect it."
182, Gideon's Stand (????) , sci-fi ," On near-future Earth, dwindling fuel supplies have sparked worldwide strife. Major economies square off against third world terror groups. NCR 1236, a small off-world methane refinery on Titan (Saturn's moon), eases the demand and a small crew of hardy roughnecks and military personnel have stepped up to the job. Gideon Stark, a man with a past, tells lies to his daughter. She wants to know the real reason he won't come home. The truth is Gideon has much darker issues to work out. When the largest solar flare in human history strikes unexpectedly and all communications are knocked off line, Gideon discovers that he and the station are cut off from Earth. Unaware of the event scope, the crew looks forward to a temporary four day shut down. Their dreams of paid vacation evaporate when a scout ship crash lands and Major Harlee Jane, a shadowy military liaison, informs them that a massive terrorist attack has been launched under the disruption of the solar flare. She's been ordered to secure the refinery and take martial control but it's clear to Gideon that she has a hidden agenda. Soon people begin to act strange and disappear. Gideon concludes an alien terrorist, posing as human, has infiltrated the station with the goal of destroying everyone and everything on the base. No one knows ""who's-who"" as Gideon rallies the survivors for a last ditch stand to save not only their lives but the lives of every human being on Earth."
183, Lift (1997) , sci-fi , Young pizza delivery man Larry wanders through the desert waiting for the aliens to land - he believes in everything he hears and does anything anyone tells him.
184, Robot Holocaust (1986) , sci-fi ," Neo, a drifter from the atomic-blasted wastelands, arrives with his klutzy robot sidekick at a factory where slaves labor to fuel the sinister Dark One's Power Station. There, he meets a comely woman who convinces him to help rescue her scientist father, who has invented a device that can break the Dark One's control over the slaves. Gathering a motley crew of allies on the way, Neo and pals travel to the Power Station, where they confront the Dark One's evil servants."
185, Colony Wars: Vengeance (1998) , sci-fi ," Set in 4671, a century after the events of Colony Wars. In the canonical ending, the League of Free Worlds successfully fights the Earth Empire's Colonial Navy into a last stand in the Sol system, where the Navy surprisingly holds their ground. The League pulls out all forces from the system and closes the warp hole, cutting Sol off from the universe. Now devoid of access to fresh resources as a result of the closure, the Empire degrades into civil war over the succeeding decades. Only the appearance of a man named Kron and his brand of anti-League propaganda somehow keeps the Empire together."
186, Unidentified (2006) , sci-fi ," A pair of enterprising young reporters from ""Both Sides"" magazine are sent to Texas to investigate a rash of UFO sightings. Their investigation reveals a supernatural element that forces a wedge between the two reporters. As they pursue their separate and conflicting theories, their lives begin to change."
187, Replicant Terminus (2017) , sci-fi ," It is now 2050-Your world, on earth/Terra. The year is 2050, The 4th world war ended 20 years ago, 2030, and humanity is now under the control of the 'mind of terra' one world government order. The MOT is responsible for ""maintaining humanity"" and protecting terra from off world, OW, influences, MOT is a government of council seats/chairs from all over the planet to maintain 'order, law, justice, humanity, science and clarity.' They move with impurity, swiftness and secrecy. Despite their "" control and order"" the rebellions wage and terra is breached regularly keeping the blade runners, office of replicants, safety , ORS, very active and busy."
188," ""The Strange & Mysterious Life of Jackson Bean"" (2015) ", sci-fi ," Due to a sudden shift in the global climate, the world as we once knew it has suffered catastrophic circumstances. The survivors have sought refuge in massive underground bunkers where they live and thrive. That is, until Jackson Bean wakes up from his dream."
189, Mindbenders (2004) , sci-fi , Innovative surrealistic sci-fi thriller about three wayward young women with extraordinary powers being hunted by mysterious agents from a secret institute as they try to make sense out of their lives in a crazy world they don't understand. Great fight scenes and a surprise ending you have to see to believe.
190," ""Gunblade"" (????) ", sci-fi ," An evil scientist named Dr. Dexter and his supercomputer OLYMPUS unleash a sealed evil clan called the Gothic, causing untold destruction and threatening the human race to extinction. A special six member task force called the Gunblade Team is formed, using special smart phone devices called GB Drives to summon app weapons and powered exosuits to perform superhuman feats to combat this threat."
191, Night Traveler (2013) , adventure ," Night Traveler: Prophecy of the Elder follows musician Jake Whitman on a journey of discovery and adventure. After being fired from his only steady gig, Jake is lured down a dark dirt road by a ghostly apparition, causing him to wreck his motorcycle. Rescued by an elderly Native American, Jake is introduced to the origin of dreams, where four challenges will stand between destiny and destruction..."
192, Wasteland Wars (2017) , adventure ," Guide our hero, Brimstone - in an epic quest across the Wasteland in search of rogue Weepers! Avoid impending doom on your journey as you drive Brim throughout the deepest, darkest route Hell has to offer! Control the ""Main Man from the Wasteland"" in an all out firefight against demons, creatures and competing Borderhound units straight from the hit comic book, ""Brimstone and The Borderhounds."""
193," ""Lost in the Game"" (2016) ", adventure ," A group of teenagers receive mysterious invitations to attend a summer camp. At first glance it appears to be a regular survival camp where the kids take on various physical challenges, but one by one some of the children are secretly taken to a hidden part of the camp. While the others think they've been sent home, the chosen few are introduced to an incredible virtual reality game where they face new challenges in the Middle Ages. Before long, those left behind begin to get suspicious, wondering what's really happened to their friends and why the camp staff are so secretive about the strange man living in the mansion in the woods."
194, The Mandala (2000) , adventure ," When an appraiser tells a proud owner that his priceless antique is really a phony, the stage is set for vengeance and several cute woman are tied and gagged as a result. In the second story, a saleswoman sends a stressed telemarketer into a bondage frenzy."
195, Dangerous Diva's Naked Prisoners (2009) , adventure ," Pretty blondes who possess family heirlooms are no match for Dangerous Diva, a masked, cat-suited villainess, her likes to strip, bind and gag her victims after relieving them of their valuables. In the next vignette, DD re-steals an incriminating tape from a femme fatale then fondles the beautiful blonde who is bound and helpless in her shower. In the final story, the Diva is more interested in toying with her naked prisoner than in stealing her goodies."
196, Stripped for Bondage (2011) , adventure ," A beautiful hostage is rescued by an unlikely heroine, who transports her to another location then fondling her helpless bound and gagged victim. When a woman tries to rescue her woman whom she finds bound in their garage, she becomes the villains' next victim. A party girl, a naive woman and two busty babes also find themselves tied with taut ropes and silenced by cloth or tape."
